{
  "schema_version": "1.0.0",
  "source_system": "LEGACY_CASE",
  "source_system_version": "v4.2",
  "generated_at": "2024-03-12T14:22:00Z",
  "generated_by": "doj-mapping-engine@pipeline.gov",
  "approved_by": "j.rodriguez@doj.gov",
  "approval_timestamp": "2024-03-14T09:45:00Z",
  "job_id": "a1b2c3d4-e5f6-7890-abcd-ef1234567890",
  "description": "Approved field-level mappings for all three source systems: LegacyCaseManagement v4.2, OpenJustice CSV exports, and ad-hoc client/incident Excel extracts.",

  "mappings": [

    {
      "source_table": "tbl_Defendant",
      "source_column": "DEF_FULLNAME",
      "source_data_type": "NVARCHAR(255)",
      "target_table": "Stg_Contact",
      "target_column": "FullName",
      "target_data_type": "NVARCHAR(255)",
      "confidence": 0.97,
      "status": "APPROVED",
      "transformation": {
        "type": "STRING_TRIM"
      },
      "rationale": "Exact semantic match. Source field stores defendant full name in 'LAST, FIRST MIDDLE' format matching the target convention.",
      "reviewer": "j.rodriguez@doj.gov",
      "review_timestamp": "2024-03-14T09:45:00Z",
      "reviewer_note": "Confirmed format matches Stg_Contact FullName convention after reviewing 2000 sample rows.",
      "is_pii": true,
      "pii_handling": "PASSTHROUGH",
      "nullable": false,
      "tags": ["identity", "name"]
    },

    {
      "source_table": "tbl_Defendant",
      "source_column": "DEF_SSN",
      "source_data_type": "CHAR(11)",
      "target_table": "Stg_Contact",
      "target_column": "SSN_Hash",
      "target_data_type": "CHAR(64)",
      "confidence": 0.97,
      "status": "APPROVED",
      "transformation": {
        "type": "SHA256_HASH"
      },
      "rationale": "SSN must be hashed with SHA-256 before landing in the staging table per DOJ data-at-rest policy DG-2023-14. Hash is stored as 64-character uppercase hex.",
      "reviewer": "j.rodriguez@doj.gov",
      "review_timestamp": "2024-03-14T09:45:00Z",
      "reviewer_note": "Verified SHA-256 hash function applied. Dashes stripped from SSN prior to hashing.",
      "is_pii": true,
      "pii_handling": "HASH",
      "nullable": true,
      "tags": ["identity", "pii", "sensitive"]
    },

    {
      "source_table": "tbl_Defendant",
      "source_column": "DEF_DOB",
      "source_data_type": "NVARCHAR(20)",
      "target_table": "Stg_Contact",
      "target_column": "DOB",
      "target_data_type": "DATE",
      "confidence": 0.93,
      "status": "APPROVED",
      "transformation": {
        "type": "DATE_PARSE",
        "date_format": "MM/dd/yyyy"
      },
      "rationale": "Source stores date of birth as a string in MM/dd/yyyy format. Confidence slightly below 1.0 because a small proportion of records use yyyyMMdd (pre-2001 entries) — handled by the COALESCE fallback in the transform.",
      "reviewer": "j.rodriguez@doj.gov",
      "review_timestamp": "2024-03-14T09:48:00Z",
      "reviewer_note": "Confirmed fallback parse handles legacy yyyyMMdd format. Null where parse fails.",
      "is_pii": true,
      "pii_handling": "PASSTHROUGH",
      "nullable": true,
      "tags": ["identity", "pii", "date"]
    },

    {
      "source_table": "tbl_Defendant",
      "source_column": "RACE_CODE",
      "source_data_type": "CHAR(2)",
      "target_table": "Stg_Contact",
      "target_column": "RaceCode",
      "target_data_type": "NVARCHAR(20)",
      "confidence": 0.82,
      "status": "APPROVED",
      "transformation": {
        "type": "LOOKUP",
        "lookup_table": "ref_race_codes",
        "lookup_source_col": "legacy_code",
        "lookup_target_col": "nibrs_code"
      },
      "rationale": "Legacy system uses a 2-char race code (B, W, H, A, N, O, U) that must be mapped to NIBRS race codes. Confidence 0.82 because code 'O' (Other) maps to multiple NIBRS values depending on context — escalated 43 unmapped values to reconciliation queue.",
      "reviewer": "m.thompson@doj.gov",
      "review_timestamp": "2024-03-14T11:30:00Z",
      "reviewer_note": "Code 'O' default-mapped to NIBRS 'U' (Unknown) per SME guidance from DA office. 43 records manually reviewed.",
      "is_pii": false,
      "nullable": true,
      "tags": ["race-ethnicity", "nibrs", "demographics"]
    },

    {
      "source_table": "tbl_Defendant",
      "source_column": "SEX_CODE",
      "source_data_type": "CHAR(1)",
      "target_table": "Stg_Contact",
      "target_column": "GenderCode",
      "target_data_type": "NVARCHAR(10)",
      "confidence": 0.95,
      "status": "APPROVED",
      "transformation": {
        "type": "LOOKUP",
        "lookup_table": "ref_gender_codes",
        "lookup_source_col": "legacy_code",
        "lookup_target_col": "standard_code"
      },
      "rationale": "Source uses M/F/U. Target accepts M/F/X/U. Direct lookup with high confidence. 'U' (Unknown) passes through unchanged.",
      "reviewer": "j.rodriguez@doj.gov",
      "review_timestamp": "2024-03-14T09:50:00Z",
      "is_pii": false,
      "nullable": true,
      "tags": ["demographics", "gender"]
    },

    {
      "source_table": "tbl_Case",
      "source_column": "CASE_NO",
      "source_data_type": "NVARCHAR(50)",
      "target_table": "Stg_Case",
      "target_column": "CaseNumber",
      "target_data_type": "NVARCHAR(100)",
      "confidence": 0.97,
      "status": "APPROVED",
      "transformation": {
        "type": "STRING_TRIM"
      },
      "rationale": "Direct 1:1 mapping of the primary case docket number. Trimmed to remove legacy trailing whitespace.",
      "reviewer": "j.rodriguez@doj.gov",
      "review_timestamp": "2024-03-14T09:51:00Z",
      "is_pii": false,
      "nullable": false,
      "tags": ["case-identity"]
    },

    {
      "source_table": "tbl_Case",
      "source_column": "CASE_TYPE_ID",
      "source_data_type": "INT",
      "target_table": "Stg_Case",
      "target_column": "CaseTypeCode",
      "target_data_type": "NVARCHAR(50)",
      "confidence": 0.88,
      "status": "APPROVED",
      "transformation": {
        "type": "LOOKUP",
        "lookup_table": "ref_case_type_codes",
        "lookup_source_col": "legacy_id",
        "lookup_target_col": "jn_case_type_code"
      },
      "rationale": "Legacy case type is an integer FK to a reference table. 95% of values map cleanly to JN case type codes. 12 legacy codes have no direct JN equivalent and were mapped to UNKNOWN pending SME review.",
      "reviewer": "m.thompson@doj.gov",
      "review_timestamp": "2024-03-14T11:35:00Z",
      "reviewer_note": "12 unmapped codes reviewed — 10 mapped to CIVIL-OTHER, 2 escalated to policy team.",
      "is_pii": false,
      "nullable": false,
      "tags": ["case-classification"]
    },

    {
      "source_table": "tbl_Case",
      "source_column": "FILE_DATE",
      "source_data_type": "DATETIME",
      "target_table": "Stg_Case",
      "target_column": "FilingDate",
      "target_data_type": "DATE",
      "confidence": 0.96,
      "status": "APPROVED",
      "transformation": {
        "type": "CAST",
        "cast_to_type": "DATE"
      },
      "rationale": "Source stores a full DATETIME; target requires DATE only. Time component is discarded. Confidence high as the date portion is always populated.",
      "reviewer": "j.rodriguez@doj.gov",
      "review_timestamp": "2024-03-14T09:52:00Z",
      "is_pii": false,
      "nullable": true,
      "tags": ["date", "case-dates"]
    },

    {
      "source_table": "tbl_Case",
      "source_column": "JURISDICTION_CODE",
      "source_data_type": "CHAR(5)",
      "target_table": "Stg_Case",
      "target_column": "JurisdictionCode",
      "target_data_type": "NVARCHAR(50)",
      "confidence": 0.91,
      "status": "APPROVED",
      "transformation": {
        "type": "LOOKUP",
        "lookup_table": "ref_jurisdiction_codes",
        "lookup_source_col": "legacy_code",
        "lookup_target_col": "fips_code"
      },
      "rationale": "Maps legacy 5-char jurisdiction codes to FIPS county codes. 91% match rate; 9% of legacy codes are historical districts no longer in FIPS — mapped to nearest current code by geography lookup.",
      "reviewer": "m.thompson@doj.gov",
      "review_timestamp": "2024-03-14T11:40:00Z",
      "is_pii": false,
      "nullable": true,
      "tags": ["geography", "jurisdiction"]
    },

    {
      "source_table": "tbl_Event",
      "source_column": "EVT_TYPE_CODE",
      "source_data_type": "NVARCHAR(20)",
      "target_table": "Stg_Code_EventType",
      "target_column": "TargetCode",
      "target_data_type": "NVARCHAR(50)",
      "confidence": 0.85,
      "status": "APPROVED",
      "transformation": {
        "type": "LOOKUP",
        "lookup_table": "ref_event_type_codes",
        "lookup_source_col": "legacy_evt_code",
        "lookup_target_col": "jn_event_code"
      },
      "rationale": "Maps legacy event type codes (HRNG, DISP, SENT, MOTF, etc.) to JN event taxonomy. 85% confidence because 6 legacy codes lack a direct JN equivalent.",
      "reviewer": "j.rodriguez@doj.gov",
      "review_timestamp": "2024-03-14T09:54:00Z",
      "is_pii": false,
      "nullable": false,
      "tags": ["events", "case-activity"]
    },

    {
      "source_table": "arrests",
      "source_column": "RACE",
      "source_data_type": "VARCHAR(50)",
      "target_table": "Stg_Contact",
      "target_column": "RaceCode",
      "target_data_type": "NVARCHAR(20)",
      "confidence": 0.78,
      "status": "APPROVED",
      "transformation": {
        "type": "LOOKUP",
        "lookup_table": "ref_oj_race_codes",
        "lookup_source_col": "oj_label",
        "lookup_target_col": "nibrs_code"
      },
      "rationale": "OpenJustice uses verbose race labels (e.g. 'Hispanic or Latino', 'Black or African American') rather than codes. Fuzzy label matching with 0.78 confidence; 'Other' and 'Unknown' labels contribute to lower confidence. Multi-racial category not representable in NIBRS — defaulted to primary race with reviewer note.",